{"schema_version":"1.0","confirmation_id":"LS-RECREATE-CONFIRM-FIXTURE-001","recreate_request_id":"LS-PSP-REQ-FIXTURE-RECREATE-001","confirmation_type":"RECREATE_INTENT_CONFIRMED","actor_id":"ADMIN-FIXTURE-001","actor_authority":"PASSPORT_ADMIN","confirmed_at":"2026-10-04T12:01:00Z","expires_at":"2026-10-04T12:16:00Z","passport_snapshot":{"passport_id":"PSP-FIXTURE-001","version":"7","sha256":"aaaaaaaaaaaaaaaaaaaaaaaaaaaaaaaaaaaaaaaaaaaaaaaaaaaaaaaaaaaaaaaa"},"status":"ACTIVE","invalidation_reason":null}
